id,name,screen_name,text,home_location,tweet_location,mentioned_location
350097431,Sumit Naik,SumitNaik2,SBICard Connect   Application date was   th October  Till is in process  Horrible experience  Mr  Mahendra with mo,sawantwadi,sawantwadi,Mumbai
1291046645849657344,Abhishek Rathore,Abhi45196028,RiaRevealed Uttar Pradesh is a million times better than Mumbai Dawood  Abu Salim and all the big goons and master,Uttar Pradesh  India,Uttar Pradesh  India,Mumbai
216247727,Sanjay Gupta,_SanjayGupta,SO HEARTENING  Mumbai Police so proud of you for the handling of this massive challenge,Mumbai India,Mumbai India,Mumbai
577100884,Live Chennai,Live_Chennai,Colleges  reopened in  Chennai and in  TN with thin attendance only https   t co CQBhiio hH,Chennai  India,Chennai  India,Chennai
1232355839643656193,vibes,Natt45672657,NotJustSalmanPR  SMiTHiE    Okay which Davido  from Mumbai or mars   switch to video call make we confirm periodt,Dubai  United Arab Emirates,Dubai  United Arab Emirates,Mumbai
2891063438,Anindita Bhadra,Abhadra7,My brother in law was to fly to Mumbai today  While doing web check in yesterday  he saw that his flight is on,Kolkata,Kolkata,Mumbai
1302878101928460288,Science Lover,VictoriaJaneWa5,urvoicematters  Ambulance driver says he brought the body down  Mumbai police say they brought the body down  Serv,Assam,Assam,Mumbai
22052895,TMJ-INH IT Jobs,tmj_inh_it,If you re looking for work in  Hyderabad  Telangana  check out this  IT job via the link in our bio  BTA CON  Custo,Hyderabad,Hyderabad,Hyderabad
1095484218,Afeef Ibn Albra,ranaalikash,Telangana High Court on Wednesday directed the Transco authorities to conduct poll climbing test to two women candi,World,World,Hyderabad
2486762587,Alive,Dhriyamana,khutism Do you mean people able to execute a fraud that too in areas like West Bengal or Hyderabad  where Local Ad,Utopia,Utopia,Hyderabad
4774969895,Roads of Mumbai 🇮🇳,RoadsOfMumbai,High time Mumbai gets Fire Dept  amp  Traffic Department on Twitter as well  What say Mumbaikars   CMOMaharashtra,Mumbai  India,Mumbai  India,Mumbai
273272270,Hema Malini Samy,HemaMaliniSamy,Just posted a photo   Chennai  India,Malaysia,Fort Tondiarpet,Chennai
1067672809801838594,MazhaiKaruvi,Puducherryrains,BureviCyclone  Burevi    hour loop  puducherry  Chennai  chennairains  chennaiweather  ChennaiRains  RainStorm TN,Puducherry,Puducherry,Chennai
1252273748763455490,Abubakar Siddiq,Abubaka32580637,FlyWithIX  HardeepSPuri  MoCA GoI Hello sir and mam  Saudi to Hyderabad available December schedule I needed,Dammam  Kingdom of Saudi Arabi,Dammam  Kingdom of Saudi Arabi,Hyderabad
1129046422077231104,RADHEKRISHNA,sradha03,MakeMyTripTech my friend had booked his air tickets from chennai to mumbai in april      but due to covid flights,SAARE JAHANSE ACCHA HINDUSTAN,SAARE JAHANSE ACCHA HINDUSTAN,Chennai
1260895956423204864,Hari Sathish,420_vk,angry rantman Please do a rant atleast on the upcoming t   series rantman bhai   fan from chennai,chitlapakkam,chitlapakkam,Chennai
148306270,Autar Durani,akdurani,KFintech     am trying to call your Chennai office but no response  Want to check status of my Folios of UTI mutua,delhi,delhi,Chennai
429816460,Girishchandra Puri,purigb,Adani Elec Mum No power supply at Chandrika Apartments  Manchubhai Road  Malad East Mumbai,Mumbai  India,Mumbai  India,Mumbai
47611583,Arun Mohan Chennai,_arun_chennai_,Sairam         votes doesnt matter  only channel decides  who have to go  Sure they wont send sanam  anitha and sh,Chennai  Tamilnadu  India,Chennai  Tamilnadu  India,Chennai
1106176933904015362,MultiplyMyLeads,multiplymyleads,House for Sale     Sq  Feet in prime Alpenia  Mokila     Cr The property has a built up area of     Sq  Feet,Delhi,Delhi,Hyderabad
467380750,Heytamilcinema,Heytamilcinema,ChiyaanVikram s  Cobra shoot resumes in chennai today  After few days  shoot will be moved to Russia      of shoot,Chennai  India,Chennai  India,Chennai
47304035,serendipity always,Abhi972,speaks my mind  Nah  It s just an age old light banter going on between Pune and Mumbai peeps  Nothing serious abo,cloud    of Hell,cloud    of Hell,Mumbai
957663988069810176,ANAND PARMAR,anandparmar1912,yadavakhilesh Bullywood pura jis sankirnta aur ek kuchh had tak underworld giroho k hatho me chal raha hai us pr a,Idar Gujarat,Idar Gujarat,Mumbai
979273137136300032,India Ahead News,IndiaAheadNews,Hyderabad  Only green crackers allowed on Christmas and New Year  says pollution board  The NGT passed directions,India,India,Hyderabad
818490257171582976,Saikat Majumder,SaikatRanchi,Eatala Rajender  EATALAOffice  TelanganaCMO Please extend all possible help including financial help and save life,Ranchi  Jharkhand   India,Ranchi  Jharkhand   India,Hyderabad
3160630932,MySocietyClub -Housing Society Management Software,mysocietyclub,get instant notification from anywhere and anytime once your visitor enter and exit into the premises  For more inf,Mumbai  India,Mumbai  India,Mumbai
1321995824914554880,🕉️ Hindustāni 🕉️ 🛕 ♒,HSickulars,Sansad  Majlis e Ittehadul Musalmeen   AIMIM   Hyderabad  India       I regret the continuing of massacre of Hindu,Bharat,Bharat,Hyderabad
545023949,//garud 🦅,kb50080,vivekagnihotri I love Mumbai but Ye sab toh upar upar ka bata rahe ho niche wale kuch bata nahi rahe ho mafia  gun,Mollem,Mollem,Mumbai
1019197042738909184,sivakumar ramakrishnan,sivakumarramak4,Celebration started in Kolathur Chennai,Chennai,Perambur Purasavakam,Chennai
18329263,Blood Donors India,BloodDonorsIn,Hyderabad Need  Blood Type   O positive At   AIG Hospital  Blood Component   Blood Number of Units     Primary N,Mumbai  India,Mumbai  India,Hyderabad
896740409346371584,editorji,editorji,On the eve of  InternationalDayofPersonswithDisabilities     visually impaired people in  Chennai weaved    chairs,Sultanpur  New Delhi,Sultanpur  New Delhi,Chennai
990761677,Mumbai Mirror,MumbaiMirror,Police arrest one accused  Hunt on for accomplice  https   t co NnCrG Re j,Mumbai  India,Mumbai  India,Mumbai
3713515945,Ankit Gandhi,AashaInteriors,Interior Expertise  AashaInteriors is recognized as one of the best interior designers in Mumbai due to expertise i,Thane  Maharashtra,Thane  Maharashtra,Mumbai
153327612,Siddharth Kannan,sidkannan,A university in Hyderabad names their humanities department after  SonuSood  This is such a sweet gesture and well,Mumbai,Mumbai,Hyderabad
1287350730211303425,Shashi,Shashi78475122,AUThackeray  Asif Zakaria  indiannavy  mayor mumbai  KishoriPednekar What happened to  RingRoad of  Pune what are,India,India,Mumbai
1140118543003869184,Cheetacampuptodate,Cheetacampup2,Operationclean of Trombay Mumbai police   Need to clean more worms  Cheetacamp  MACOCA,Mumbai  India,Mumbai  India,Mumbai
752699352796266496,Trident Chennai,TridentChennai,Continue enjoying the Trident Experience in the comfort of your home  Order exotic kathi rolls  desserts  beverages,Chennai  India,Chennai  India,Chennai
38647512,The Indian Express,IndianExpress,India detected        new cases of coronavirus infection on Wednesday  taking its overall tally to over       lakh,India,India,Chennai
958381753571295232,Surviving for Justice,saviour_era,Instead of investigating facts  they shut the mouth of a judge  JudicialCorruption  LegalTerrorism https   t co Ews Mzds C,India,India,Chennai
976526587272355845,Hyderabad news,newsFromHyd,PM Modi calls Bandi Sanjay Kumar  inquires about BJPs prospects  via  Bandi Sanjay Kumar,Hyderabad  India,Hyderabad  India,Hyderabad
1108369969891278848,Prince Majestic,PrinceMajestic_,Seeking  franchisees for our  brand of  ethnic  Garments  Contact            for queries  Visit our website for exc,Kolkata  India,Kolkata  India,Hyderabad
1106764756344422400,Mohd Faraz Khan,faraz_khan81,ACTFibernetHYD You guys have the worst customer service in Hyderabad and I suggest tomy brother tonot take,Hyderabad  India,Hyderabad  India,Hyderabad
3910319473,RICS SBE,RICS_SBE,HouseOnPaliHill   Mumbai Designed by  StudioMumbai  this project was built by stripping down an existing house  e,Noida  Uttar Pradesh,Noida  Uttar Pradesh,Mumbai
713613365529026563,Sadanand,sadanand_mumbai,Nitzmatazz And Toll too   if one has to go out of mumbai       let s hope    Nita      achhe Din aayenge,Mumbai  India,Mumbai  India,Mumbai
19703907,Nora Fatehi Fan England,norafanengland,Gorgeous Nora Fatehi at  Hyderabad Airport yesterday      NoraFatehi  NoraFatehiFans  WeLoveNoraFatehi  Nora,England  United Kingdom,England  United Kingdom,Hyderabad
1113747196099399680,First India,thefirstindia,Chennai trial case is an incidental finding rather than related to vaccine  When we vaccinate a large number of pe,Jaipur  India,Jaipur  India,Chennai
1333726575158652928,Patel Jimit,Ji73824440Jimit,VFSGlobal dear sir madam i want to change my venue to submit biometrics which has earliest date available form Che,Ahmadabad City  India,Ahmadabad City  India,Mumbai
826353132716240897,News Chant,NewsChantOnline,After GHMC polls  Fearing Covid    second wave in Telangana  party workers  leaders advised a week s self isolation,India,India,Hyderabad
2612033095,Mira S. Ghoshal,MiraGhoshal,Celinetruths    adz cfc  DOckerby   sankarchanda    addicted newz  SatishBahri  vinnykhullar  j chatwani,The Indo European Homeland,The Indo European Homeland,Mumbai
1284467559635357697,ABDULLAH NEAZ,abdullah_neaz,DharampalGulati is no more on Thursday morning he passed away at the age of    He has been awarded Padma Bushan fo,Dhaka  Bangladesh,Dhaka  Bangladesh,Chennai
2227025790,MR. Sudhir,ssaran999,Mr  Gulab Patil Ji     Mumbai is THE place full of dacoits and rogues  in the form of Politicians in power and the,Universe,Universe,Mumbai
1198916905245036545,30 Stades,30stades,Mumbai s Caf  Arpan is run by a    member team of differently abled adults with  autism   DownSyndrome  amp  other,Mumbai  India,Mumbai  India,Mumbai
38069711,TMJ-INH Jobs,tmj_inh_jobs,Deloitte is hiring in  Hyderabad  Telangana  Click the link in our bio to apply  A amp C   Data Science   AI ML  BusinessMgmt,Hyderabad,Hyderabad,Hyderabad
53332547,amrit anand,amritanand,EXCITING WORLD OF STARTUPS   Between Jan Nov  Indian startups received       Bn in     funding deals     startups,Delhi NCR  India,Delhi NCR  India,Mumbai
990761677,Mumbai Mirror,MumbaiMirror,Family tells cops he was threatened and beaten up by a lender for loan recovery  https   t co nxwNKyTDdV,Mumbai  India,Mumbai  India,Mumbai
107361680,Maritime Gateway,maritimegateway,Chennai Port to get digitised operations,Hyderabad  India,Hyderabad  India,Chennai
789329834510053376,Lohith Paul,LohithPaul,I thought we lost our crops  but look how Jesus protects His people  Nothing happened  Take a look at this video  T,Nellore  India,Nellore  India,Chennai
287214126,Amarjyoti Borah,AmarjyotiBorah1,Deepali p There are film cities in other parts of the country also  but the Hindi movie industry is always associa,Guwahati  Assam  India,Guwahati  Assam  India,Mumbai
2826053870,AHMED  SHAIK,SHAIK9059,Beautiful view  RGIAHyd  Hyderabad  swachhhyd,HYDERABAD,HYDERABAD,Hyderabad
1261119739796979712,Dinesh krishna Muthireddy,dinesh_krishna,Latest snaps of Bunny   Stylish Star  AlluArjun back to Hyderabad   RGIAhyd  alluarjun  Pushpa  AA    alluarjun,Vijayawada,Vijayawada,Hyderabad
1326839798439399425,@indiapran_bharat. #ISupportFarmerBill,Indiapran_alt,Maharashtra today      Paying HUGE price of lower voter turnout  in last Assembly Election   ASSUMING easy victory,Bharatvarsh,Bharatvarsh,Mumbai
1156273506486611968,Mr.Raja ;-),Marana_Mass,Join me in visiting all cities in the Go India game  amp  earn a reward up to,India,India,Chennai
604498301,christy bharath,contentbirder,The common hoopoe looks anything but common  Its frilled orange crest flares up like a storybook finish to the life,Chennai,Chennai,Chennai
2579558348,India Post,IndiaPostOffice,Rohit        ka Sir  the issue is not clear  For complaint queries related to Santacruz East Post office  please s,New Delhi,New Delhi,Mumbai
2597798635,Chaat 💥Masala 💥,LiarNair,CricCrazyJohns Maharashtra already has Mumbai   they should go with Lucknow,Ask your Mama,Ask your Mama,Mumbai
132599813,Anil Kamma,anilkumarkamma,GoIndiatickets Join me in visiting all cities in the Go India game  amp  earn a reward up to,miryalaguda,miryalaguda,Chennai
938793362630389760,Express Mumbai,ie_mumbai,Over       residents of villages near Vadhavan in Dahanu came together at the proposed site of the Vadhavan port to,Mumbai  India,Mumbai  India,Mumbai
1136989005457715200,Kethasguptha🇮🇳,Kethasguptha3,The present population of tamil brahmins might be just  to      But soon the population will decline to the lowest,bharata,bharata,Chennai
1160910019,Light-Say-Burr,gotzerochill,In Mumbai  you can t dance like no one is watching as Maheep Kapoor lives there with her binoculars,New Delhi,New Delhi,Mumbai
2566625718,Rohan S. Patne,RohanPatne12,Mumbai should permanently stay in December mood yaar,Mumbai  India,Mumbai  India,Mumbai
1330902891687645187,Aishwarya Rajesh’s Ardent Fan,aishu_dilfan,Aishu chennai  aishu dil But this is really less for her she deserves more love she is a lady with full of positiv,Tamil Nadu,Tamil Nadu,Chennai
1186262215147474944,India Info 24,indiainfo24,Actor Rajinikanth announce  Establishment of NEW POLITICAL PARTY on   st December Govt Jobs,Chennai,Chennai,Chennai
1332997339854761990,Mazinatocov,lordadithyad,Arvinde          ashwin     AllAboutSikhism  narendramodi  airindiain People were unable to afford it        Occu,Akhand Bharat,Akhand Bharat,Mumbai
840480574674501632,Pranay Kumar,Pranayyadav0909,I haven t received any update on my biometric appointment after   days of webform submission  Application no  S,Karimnagar  India,Karimnagar  India,Hyderabad
88164343,PropertyWala.com,propertiesindia,Furnished  OfficeSpace in BKC  ForRent  BandraEast  Mumbai  Commercial  Property https   t co pYGRzzQbAm,India,Mumbai,Mumbai
1330883106396536832,Riya,Riya11941439,myogiadityanath Karvykdk LTD Hyderabad Last   Month salary and   YR PF not provided  we are unable to pay EMI Scho,Hyderabad  India,Hyderabad  India,Hyderabad
812235133667287040,HNN24X7,HNN24X7,I never go back on the promises I make  Political change is necessary  It is the need of the hour  If it is not don,India,India,Chennai
69899708,Rajesh Kurup,RajeshKurrup,NCLT Mumbai approves Reliance Infratel s resolution plan,Mumbai,Mumbai,Mumbai
472321669,Goal Africa,GoalAfrica,ISL          Manolo Marquez has brought out the best from his Indian players,Africa,Africa,Hyderabad
345959462,sai trinath,saitrinath3939,HathwayBrdband i went to your technicians office they said they are not responsible and i went to your office in c,Hyderabad  India,Hyderabad  India,Hyderabad
862584139798650880,Cake Square,CakeSquareoff,Baked with love  amp  delivered with care  Call  amp  oder  anniversarycakes to make your special day more memorable  To O,Chennai  India,Chennai  India,Chennai
18329263,Blood Donors India,BloodDonorsIn,Hyderabad Need  Blood Type   O positive At   Asian Hospital  Gachibowli Blood Component   Platelets Number of U,Mumbai  India,Mumbai  India,Hyderabad
894091822179299328,Saravana Marundhagam,saravanamarundh,Suffering from Piles  Get Painless relief from Piles and Fissure with Naga Parpam  An Effective Herbal remedy  For,Arumbakkam,Arumbakkam,Chennai
630505530,HK,hemalkarelia,aaidoonairport  UTDBofficial kindly give clarity on whether we need to produce negative covid test result if comin,Bombay  India,Bombay  India,Mumbai
1229995024252907520,Vignesh Bhatt - Traveller / Adventurer 🌏,thenomadguy,maha tourism  YuluBike  tourismgoi  MahaDGIPR U need to come out with some innovation for sustainable long distanc,India,India,Mumbai
1281602929816829954,sarah⁷ jin day soon !!,lordesrkive,desisope yeah   in mumbai i think and sonam kapoor was in the video ig it s such an amazing song,mainly bts txt lorde,mainly bts txt lorde,Mumbai
1181906273152843777,TNIE Tamil Nadu,xpresstn,While the lockdown made learning hard for all  the impact has been worse for visually impaired students  There is a,Chennai  India,Chennai  India,Chennai
854790800760352768,RealIndian,NationalRevolu,In Hyderabad  Muslim population crossed     now we are majority  So I demand impose restrictions on the celebrat,India,India,Hyderabad
967709555927998464,Mahi@7745,Maahi772,Thalaiva      NetflixChill    CricCrazyJohns It s telengana team   whoever owns It s called by sun raisers Hyderabad,vijayawada  india,vijayawada  india,Hyderabad
2435078106,Hyderabad Intellectuals Forum,HydForum,vinay vangala  CoreenaSuares   srikieonline  Director EVDM  CommissionrGHMC  arvindkumar ias  KTRTRS  CCP GHMC,Hyderabad,Hyderabad,Hyderabad
766692063702310912,MMA India,MMAIndiaShow,UFC Gym opening soon in Mumbai     The  MMAIndiaShow will be getting the first look of  UFCGYM  Mumbai before it l,India,India,Mumbai
1260446734016274433,Yogi Jaya Kumar,jkyogamaster,I am really proud of you  Natu Chennai Boy  Keep going  Congrats Team India,chennai,chennai,Chennai
1274333173028057092,RuhiSSR ( love ssr only ❤❤),RuhiSSR,Akshit          ab         Aur Mumbai mai   baje kai bad Ray  drugs party and aur bhut kuchh krte hai     Atleast,Ssr ki  yado mai,Ssr ki  yado mai,Mumbai
1311689540831113216,Vishnu,Vishnu83949882,PrasadSoman   abpmajhatv  rautsanjay   My Fight is not against Maharashtra State  my fight against EGO of Maharash,Rajasthan,Rajasthan,Mumbai
1106176933904015362,MultiplyMyLeads,multiplymyleads,BHK Flat in building for Sale in Shilpa Apartments  Shilpa Valley     Sq  Feet      Crores The property has a,Delhi,Delhi,Hyderabad
2976482291,Dév,dsdav3,ASUS ROG Please sirs do the needful and sent me the rtx      no stock in mumbai no money  i make the youtube shout,Degec,Degec,Mumbai
1577019044,Marine Luxury Lifestyle,Chartercatamara,Tamil Nadu Sailing Association,Phuket Province  Thailand,Phuket Province  Thailand,Chennai
4483074194,ARTISTRYBUZZ,ArtistryBuzz,Slayer    RaashiKhanna Papped at  RGIAHyd off to chennai    kamlesh nand  RaashiKhanna,Hyderabad   mumbai India,Hyderabad   mumbai India,Chennai
1308381305432809475,Hyderabad Pedestrian Project,HyderabadPedes1,urbanvoicesin Near Hitec Metro Station Hyderabad,Hyderabad  India,Hyderabad  India,Hyderabad
147104875,Shakuntalaputra raghavendra 🇮🇳(O+ve),Raghvarma,urbanvoicesin Banjara Hills Jubilee Hills Madhapur Kondapur Gachibowli  Hyderabad means these areas only,Hyderabad Telangana India,Hyderabad Telangana India,Hyderabad
1284467559635357697,ABDULLAH NEAZ,abdullah_neaz,DharampalGulati is no more on Thursday morning he passed away at the age of    He has been awarded Padma Bushan fo,Dhaka  Bangladesh,Dhaka  Bangladesh,Hyderabad
1219929622076260354,Care Earth Trust,careearthtrust,They should go all out to protect such marshlands and not destroy them  These are ecologically sensitive areas tha,Chennai  India,Chennai  India,Chennai
295693924,Free Press Journal,fpjindia,Coronavirus in Pune and Pimpri Chinchwad  PMC s COVID    tally rises by      PCMC records     cases,India,India,Mumbai
3777982577,Ramana,nramana5,projects today  noidametrorail can significantly add value to the project by transforming,Hyderabad,Hyderabad,Hyderabad
88164343,PropertyWala.com,propertiesindia,Land Plot  ForSale in sriskandha developers   Bhongiri    Sq  Yards      Lacs   Bedroom  ResidentialPlot,India,Bhongir,Hyderabad
1202124874594050048,S. Vishnu Vardhan Reddy,SVishnuReddy,Mumbai is part of india same as Noida or Hyderabad  If Yogiji is doing something for betterment of UP  amp  meeting fil,New Delhi  India,New Delhi  India,Hyderabad
1330883106396536832,Riya,Riya11941439,teamTSIC  KTRTRS  Koppulaeshwar   jayesh ranjan  ravignarayan  WCDTelangana  MinisterKTR  KonathamDileep  THubHyd,Hyderabad  India,Hyderabad  India,Hyderabad
74136483,Ashish Malik,ashishdsc,Thanks a lot  SQLMaria for the wonderful session  Gained lots of insights   Sangam    aioug  AIOUG  aioug pune,Delhi,Delhi,Chennai
978203447475388416,সংযত স্বভাবের মানুষ నిగ్రహ స్వభావం గల మనిషి,themouryan,ActuallyyJP The photo on the left is so serene  Is that IIT Hyderabad,Hyderabad  India Kolkata,Hyderabad  India Kolkata,Hyderabad
4706741402,Murali Parvesh,murali_parvesh,Vijaya  sexy I m in chennai only i can meet you dear,Tamil Nadu  India,Tamil Nadu  India,Chennai
298549322,Fuel Price Hike,FuelPriceHike,DieselPrice in  Chennai  hiked by       L  new price         L  Change since       days             days             days,India,India,Chennai
1043374071033937920,Kishore Vj,SaiKish73843197,Gorgeous Girl  RaashiKhanna in  Chennai  RaashiKhanna  TrendsRaashi  VarunPK  RK,Perambalur,Perambalur,Chennai
1192939893971935232,Sehar Arif,SeharArifRana,SaluteDisabledPersons Abdul Salam  another symbol of courage   He lost his arms in an accident  He is    years ol,Sialkot  Pakistan,Sialkot  Pakistan,Hyderabad
1323215620117164032,Plutonium Group,plutoniumgroup,RAISE A TOAST TO HIGN END LIFESTYLE  business  plutoniumgroup  plutoniumbusinesspark  realtors  realestateagent,Turbhe,Turbhe,Mumbai
623451254,Chocoman's,theCHOCOMANS,THANK YOU CHENNAI     We are excited to have served   MILLION Customers in our   Years Journey in Chennai  To shar,Chennai,Chennai,Chennai
929409604471087104,Jason,Chennai_Techie,BSNLCorporate Haven t got the deposit amount till now    month gone   BSNL TN  BSNLCorporate,Chennai  India,Chennai  India,Chennai
4767528991,Telangana Today,TelanganaToday,Mumbai s Tao Art Gallery to open first post Covid exhibition,Hyderabad  Telangana,Hyderabad  Telangana,Mumbai
22047560,TMJ-ICH IT Jobs,tmj_ich_it,Flex is hiring in  Chennai  TN  Read about our latest  IT job opening via the link in our bio  Systems Analyst   IT,Chennai,Fort Tondiarpet,Chennai
349726136,Carpe Diem (Amitabh Choudhury),amitabhisgood,AMOR  Liquidated Short stories Book    by Amitabh Choudhury IN  UK,Bengaluru,Bengaluru,Mumbai
919816260858163200,सव्यसाची -SAVYASACHI,savvyasaachi,HYDERABAD Allegations of rigging  other malpractices are roaming around    Many such news videos complaints hea,Kerala,Kerala,Hyderabad
157959833,Deepali Prabhu,Deepali_p,Sanjay        BJP India You can be born anywhere   but the kind of ART that we are discussing here exists particul,mumbai,mumbai,Mumbai
156918344,Chaitanya Mehta,cmehta85,Anyone s going to watch  Tenet at a Mumbai theatre,Mumbai  India,Mumbai  India,Mumbai
294082654,Sampoorna,Sampoorna_Jobs,Excellent Career Opportunity Senior Process Executive Tableu  Job Code   J       Exp      Yrs Location  Chennai Key,Mumbai,Mumbai,Chennai
215188477,BloodAid,BloodAid,Hyderabad  Emergency Need B   blood   AIG Hospital  Gachibowli  Call             BloodAid via  Ashu Tweeting cc,India,India,Hyderabad
990761677,Mumbai Mirror,MumbaiMirror,Over     fishermen are likely to be displaced  https   t co C GECQCWxb,Mumbai  India,Mumbai  India,Mumbai
2227695199,The News Minute,thenewsminute,Chennai doc says patient developed neurological issues due to COVID     vaccine  covishield,Bengaluru,Bengaluru,Chennai
1574773952,NIKHILESH VAID,Orthonik,emirates  EmiratesSupport The airport staff with Emirates at the Mumbai airport is the worst in the world      the,Mumbai  Maharashtra,Mumbai  Maharashtra,Mumbai
1202981748750946304,Suhas Ravindra,SuhasRavindra1,anilkarat  srinualavilli Heard of Chennai s mega Street project  We need tendersure works of such volume in one go,Bengaluru  India,Bengaluru  India,Chennai
778036537145556992,Om Ranjan,omranjan10,Information Warfare Canvas  By Om Ranjan   C S India   Chennai Centre for China Studies Vi,Gaya  India,Gaya  India,Chennai
4430247434,Sr.DSC_RPF_HYB division,rpfscrhyb,A news clipping was published in  SAKSHI NEWS PAPER  regarding one girl aged about    yrs  missing from train enrou,Hyderabad  Andhra Pradesh,Hyderabad  Andhra Pradesh,Hyderabad
35716467,mri (semi ia) ; 홍중 냥 🐱,ateezhobi,taegiatz omfg    i remember last december i attended the kwave meet in chennai  amp  my friend sang wave and the enti,she her,she her,Chennai
1196722964529635329,Karthik B,Chottabheeem,ANI Why price in Chennai and kolkata higher than other cities,Chennai  India,Chennai  India,Chennai
250019795,aishwaryasarees,aishwaryasarees,Repost  reshamsahnibeauty Saree from  aishwarya designstudio Mumbai  The belt is custom made from   layers of sequ,Mumbai   Ahmedabad  India,Mumbai   Ahmedabad  India,Mumbai
18329263,Blood Donors India,BloodDonorsIn,Hyderabad Need  Blood Type   Any group At   NIMS Blood Component   Blood Number of Units     Primary Number,Mumbai  India,Mumbai  India,Hyderabad
2836016810,Srinivas Koneti,koneti_srinivas,KTRTRS DRINKING WATER LEAKAGE not only causing POLLUTION but also wasting valuable water at            SAIRAM comm,Hyderabad,Hyderabad,Hyderabad
28517909,Sharell Cook,AboutIndia,Winter in  Mumbai  Aksa beach vibes   with the crows,Mumbai  India,Mumbai  India,Mumbai
955828755418755072,Maahi,msdian1221,sarcasmwalaaa Still Mumbai will like to have a good quality spinner in their team  Plus they will play   matches o,Ahmedabad City  India,Ahmedabad City  India,Mumbai
4642840513,Bihog,FlyingBihog,IIT Hyderabad Recruitment       Vacancy For The Post Of Library Trainee,India,India,Hyderabad
128827895,ikrar gilang,ikrargilang,Nonton Amazing Race eps di India dan waoow I really wanna go Hyderabad,CGK JOG,CGK JOG,Hyderabad
1174667998004539394,Hyderabad scrap buyers,scrapbuyers5199,We are the scrap Buyers in Hyderabad all items purchase best prices   For more info visit   https   t co timLbuKxfB,Hyderabad  India,Hyderabad  India,Hyderabad
1106176933904015362,MultiplyMyLeads,multiplymyleads,BHK Flat   Apartment for Sale   Lacs in Sub Susheel  Pragathi Nagar     Sq  Feet Builtup area and carpet ar,Delhi,Delhi,Hyderabad
