id,name,screen_name,text,home_location,tweet_location,mentioned_location
1306908670144311297,CHEMSPARK ACADEMY,ChemsparkA,Successful Students of the                       ChemsparkA,Mulund West  Mumbai,Mulund West  Mumbai,Mumbai
33868470,Qayed,Qayed,Malcolm Returns  DuneKhaal Sorry dude few example can t be a testimonial in a long time existed caste error  Socie,Delhi  India,Delhi  India,Mumbai
1605282109,91Realty,91realty_LLP,At      new supply share of branded developers  highest in Bengaluru  Chennai,Mumbai,Mumbai,Chennai
1255809222857482241,HSR Motors,HSR_Motors,BMW   Series Black Shadow edition launched  priced at Rs       lakh BMW Group India on Thursday launched the new,india,india,Chennai
22052895,TMJ-INH IT Jobs,tmj_inh_it,If jobs with titles like  Technology Assurance   Lead Solution Advisor Senior Solution Advisor   Hyderabad Gurgaon,Hyderabad,Hyderabad,Hyderabad
1087089927458836480,Hussain🍇¹¹,hussain_fcb10,Mumbai se hu BC  casualnepali Very very accurate,Lahore  Pakistan,Lahore  Pakistan,Mumbai
885018777833938945,B. Kandhari Properties,BKandhari_Prop,HERE UNLIMITED LUXURY SPEAKS OUT LOUD  For more details call  BKandhariGroup                 Or Visit,Mumbai  India,Mumbai  India,Mumbai
88164343,PropertyWala.com,propertiesindia,CMDA Approved  Land  ForSale at  TambaramWest CTO Colony   ResidentialPlot  Chennai  Residential  Property https   t co vHs  ghkXk,India,Sholinganallur,Chennai
1156273506486611968,Mr.Raja ;-),Marana_Mass,Join me in visiting all cities in the Go India game  amp  earn a reward up to,India,India,Chennai
2854311679,Ozone Group Official,OzoneSocial,We don t just build houses but create homes  Ozone Residential is an Ozone Group vertical that designs strong and s,India,India,Chennai
1324955932233588736,Digital Hub 16,DigitalHub161,Social Media Marketing Reach your Awareness and Engagenment  Digitalhub    mumbai  Promotin  socialmediamarketing,Mumbai,Mumbai,Mumbai
1874798778,The Hans India,TheHansIndiaWeb,GHMC election       Repolling underway at Old Malakpet division  GHMCElections      Repolling  OldMalakpet,Hyderabad,Hyderabad,Hyderabad
2897495466,Janak Pandya જનક પંડ્યા,janakp14,Is Australian Federal Police competing with Meme errr Mumbai Police,New Delhi,New Delhi,Mumbai
2265845678,surendra modi,suren1301,myogiadityanath  well done sir  film city Har statement honi chahiye  Good  modern hi tech  with all facilities  T,Mira Road,Mira Road,Mumbai
1133367793078849536,Violet Spark,TheVioletSpark,Pheli Phasand Turmeric Box Packaging Design  bangalore  brandconsultant  branding  brandingconsultant  chennai,https   g page violetspark gm,https   g page violetspark gm,Chennai
1228655592874528768,☆Sd☆,skdxoxo,sidharth shukla Hey sidharth  Sorry for being late  I m back to mumbai so just busy wid frnds n studies  so I don,SidNaaz,SidNaaz,Mumbai
18329263,Blood Donors India,BloodDonorsIn,Hyderabad Need  Blood Type   O positive At   AIG Hospital  Blood Component   Blood Number of Units     Primary N,Mumbai  India,Mumbai  India,Hyderabad
56680780,Vismay,vismayshah,priyathedentico After effects of Yogi ji s visit to Mumbai,Kyun   kya karoge jaankar,Kyun   kya karoge jaankar,Mumbai
88164343,PropertyWala.com,propertiesindia,new star city   Madhavaram   redhill road  ResidentialPlot  Land  ForSale  Chennai  Residential  Property https   t co FagxSslWoR,India,Saidapet,Chennai
82821040,Greater Chennai Corporation,chennaicorp,Here is the report on fallen trees cleared by Greater Chennai Corporation across different zones since last night,Chennai  Tamilnadu,Chennai  Tamilnadu,Chennai
1386638408,M Sunil Kumar,amicuspopuli,LAND Lawyers Chambers              A   nd floor Road No     near Bank of Baroda  Nagarjuna Nagar Colony  Tarnaka  H,Hyderabad  India,Hyderabad  India,Hyderabad
38069836,TMJ-ICH Jobs,tmj_ich_jobs,Want to work in  Chennai  TN  View our latest opening   ProductMgmt,Chennai,Fort Tondiarpet,Chennai
47625310,Dj Sunshine,djsunshineremix,Nawazuddin Siddiqui is back in Mumbai  and guess whom he s missing,Toronto  Canada,Toronto  Canada,Mumbai
62480161,Banashree,Bowtielipsticks,Just posted a photo   Mumbai  Maharashtra,Mumbai  India,Mumbai,Mumbai
97573483,Stop the Gaustapo,atlasdanced,MsSaltedPeanuts  subjudiced  violetreess Now i am curious as to how that came about being the more popular term in,Magrathea,Magrathea,Chennai
784686894906998784,IOCL Gujarat State Office,IOCGujarat,XP     India s only     Octane petrol is now available in    cities namely Agra  Ahmedabad  Chandigarh  Delhi  Guru,Ahmadabad City  India,Ahmadabad City  India,Mumbai
532029491,Ajay Singh 🇮🇳,ajayuvaach,World class Police of the Maharashtra Mumbai  Mr  CMOMaharashtra  JI   What are your police doing  Can you please,Oslo  Norway,Oslo  Norway,Mumbai
3158972118,Hardeep Kaur,KhalsaHkk,Join me in visiting all cities in the Go India game  amp  earn a reward up to,Surat  India,Surat  India,Hyderabad
313881816,CSMIA,CSMIA_Official,kpraveenca Good Afternoon  Could you please confirm from where are they travelling to Mumbai from,Mumbai  India,Mumbai  India,Mumbai
15338256,YourStory,YourStoryCo,Chennai based  biotech startup Seragen is developing therapies to treat infertility in India holistically  It claim,India,India,Chennai
256943401,Siva,sivatalks,IndiGo E It s raining throughout Tamilnadu and parts of south India due to cyclone  CycloneBurevi   I have a booki,Tamil Nadu  India,Tamil Nadu  India,Hyderabad
891159521602580480,Victor Rao,VictorRao3,Hydbeatdotcom  HrudayanandD superb Anand  Hyderabad,Hyderabad,Hyderabad,Hyderabad
1249890226350092288,R Thankappan,thankappan_r,bhupendrachaube  rajinikanth  IndiaAheadNews Who will be CM candidate   AmitShah had long discussion with,India,India,Chennai
37034483,NDTV,ndtv,Some of the most exciting scenes of  Tenet are shot in Mumbai  Director Christopher Nolan  DimpleKapadia,India,India,Mumbai
3226833492,UNITED ECO. FORUM,UEF_CHENNAI,Mr Adnan Ahmed welcomes you to join us on  th   th and  th December for UEF World Summit  Get your free pass at,Chennai  India,Chennai  India,Chennai
162346418,Tanushree Venkatraman,tanushreevenkat,Mumbai s e bike facility gains momentum  HTMumbai  YuluBike  MMRDAOfficial  WRICitiesIndia Read here,Mumbai  India,Mumbai  India,Mumbai
240649814,TIMES NOW,TimesNow,Telangana government on way to reduce walkway width outside KBR Park  https   t co cBnq Zg Mq,India,India,Hyderabad
480050121,Kongara.Venu,VenuKongara,The LightHouse  Hyderabad CREE LED Light COB Lights with CREE LED a  For more info visit   https   t co z ofpaH TL,Kukatpally  Rajendra Nagar,Kukatpally  Rajendra Nagar,Hyderabad
54506902,Curly Haired Slytherin,bendakayfry,Next time I hear someone who is not from Hyderabad but lives in Hyderabad say  Omg dude Hyd is so boring  There is,India,India,Hyderabad
1103963717178400768,Weather & Radar India,WeatherRadarIN,Projected trajectory of the  CycloneBurevi today   rd December       Red alert issued for the entire states of,Bonn  Germany,Bonn  Germany,Chennai
94761188,The New Indian Express,NewIndianXpress,bpdeepu TNIE  xpresskerala  shibasahu     NDRF team was seen surveilling at Chennai s Marina ahead of,Chennai,Chennai,Chennai
987004356,Harsh Patel,hvpatel39,VFSGlobal I got biomatric appointment date on   th december      at Ahmedabad center  But unfortunately my colleg,Gandhinagar  India,Gandhinagar  India,Mumbai
1882304006,Ecphasis Infotech,ecphasisinfo,Ecphasis Infotech  a  leading  web  hosting company in Chennai and it is the right choice to host your website,Ph,Ph,Chennai
730431353372561408,rameshkotnana,rameshkotnana1,Did You Know   ISB contributes a lot to the nature by following the best energy efficiency practices ISB Hyderaba,Hyderabad  India,Hyderabad  India,Hyderabad
19897138,IndiaToday,IndiaToday,Foreign diplomats are scheduled to visit the Covid vaccine centre in Hyderabad on December     COVID    Coronavirus,India,India,Hyderabad
1165989026890797057,Fifafooz,fifafooz1,MouniRoy snapped post dance class in Mumbai today  Roymouni,Mumbai  India,Mumbai  India,Mumbai
3076370612,Srivari DentalClinic,srivaridental,Srivari  Chennai  Smile Makeover  Smile Design  Digital Smile  Laser Dentistry  Laser Root Canal Book your appoint,Chennai,Chennai,Chennai
144044740,Good Governance 🇮🇳,sri9011,MandarSawant     amitsurg Double deckers not there in Mumbai anymore,Indraprastha,Indraprastha,Mumbai
96960689,yanand,urstrulyAndy,Raghupa          GHMCOnline  CommissionrGHMC  helekarumuri     bonthurammohan  Hyderabadbot  hyderabad,Hyderabad  India,Hyderabad  India,Hyderabad
1186262215147474944,India Info 24,indiainfo24,Actor Rajinikanth announce  Establishment of NEW POLITICAL PARTY on   st December Govt Jobs,Chennai,Chennai,Mumbai
1274543271411212289,Abhay_Mhatre,AbhayMhatre876,Frank Supercell In winters the minimum temperature at night goes down like     in Mumbai   And that s very cold for us,Mumbai  India,Mumbai  India,Mumbai
1003195562806538242,Pradeep Kushwaha,pkusrain,CycloneBurevi is now between  TamilNadu and  SriLanka coast  It will landfall today night or early morning near So,Bengaluru  India,Bengaluru  India,Chennai
310883734,தேவராஜ் சுமதி,DevarajSumathi,BloodDonorsIn  MakkalPathaiTN  rajakumaari  cartoonistbala  Tr Gayathri  pkcomrade     Emergency  Urgently require,vaniyambadi,vaniyambadi,Chennai
243940411,Nidhi Sanghvi ♔,dynamicnidhi,Just posted a photo   Mumbai  Maharashtra,india,Mumbai,Mumbai
850279748,Aneel Parmar🇵🇰,ParmarAneel,I was in hyderabad yesterday  shocked to see peoples  none of single man wore mask  then why schools and colleges a,Chachro Sindh Pakistan,Chachro Sindh Pakistan,Hyderabad
1106176933904015362,MultiplyMyLeads,multiplymyleads,House for Sale      Crores     Sq  Feet in prime Alpenia  Mokila Builtup area and carpet area are respectively,Delhi,Delhi,Hyderabad
110612755,Yamuna Harshavardhana,YamunaHarsha,Vijayabaskarofl  CMWSSB  chennaicorp  CMOTamilNadu  drharshvardhan Chennai is overflowing with sewage at many pla,Singapore,Singapore,Chennai
1237048045075722242,BharatAlert.Com,Bharat__Alert,FreshToHome expands its fresh delivery services in Bengaluru  Hyderabad  Pune,india,india,Hyderabad
893433878848741376,Ashna Enterprise,AshnaEnterprise,ThrowbackThursday At Ashna Enterprise we believe that quality is true key to the success  which is why it is part,Vasai  Maharashtra  India,Vasai  Maharashtra  India,Mumbai
18329263,Blood Donors India,BloodDonorsIn,Hyderabad Need  Blood Type   A positive At   Care Hospital  Blood Component   Blood O ve and A ve Number of Unit,Mumbai  India,Mumbai  India,Hyderabad
533962634,VenkatKrish007,centrist007,tamilgramsi MNM has got votebank above    percent in vada Chennai also   oopees stick with targeting sanghis and m,Sanand Industrial Area  Gujara,Sanand Industrial Area  Gujara,Chennai
100658353,Dr.A.Gunaranjan,guna_love,Uber this is Dr A Gunaranjan from Hyderabad why is it like the drivers asking for drop point before picking up an,Hyderabad,Hyderabad,Hyderabad
940945398843113472,Raja Sekhar Reddy kesari,rajakesarimdk,HiHyderabad  HDFC Bank  HiCyberabad  HydWatch  hyderabad zone  WithCitizen  HiTechCity  HDFCBank Cares Time,Hyderabad  India,Hyderabad  India,Hyderabad
713613365529026563,Sadanand,sadanand_mumbai,Nitzmatazz Party time,Mumbai  India,Mumbai  India,Mumbai
38069711,TMJ-INH Jobs,tmj_inh_jobs,This  BusinessMgmt job might be a great fit for you  Click the link in our bio to see it and more  Manager   ORACLE,Hyderabad,Hyderabad,Hyderabad
1181906273152843777,TNIE Tamil Nadu,xpresstn,A zip line over the Villivakkam lake in Chennai will soon become the main attraction at the upcoming eco park aroun,Chennai  India,Chennai  India,Chennai
1357278043,Laxman Shivakashipuram,laxmanskpuram,AmitShah  HardeepSPuri  EPSTamilNadu  vijayanpinarayi Not tweets  are you going to provide any monetary assistance,Andhra Pradesh  India,Andhra Pradesh  India,Hyderabad
22328013,TMJ-INH Advert. Jobs,tmj_inh_adv,See our latest  Hyderabad  Telangana  Marketing job opportunity and click the link in our bio to apply  External Au,Hyderabad,Hyderabad,Hyderabad
2643404255,himanshu mishra,himansh18933981,Sahil Kabadi  kaviraj joshi  Norms          MahantBalaknath  myogiadityanath  beingarun    Sadhvi prachi Oho kadi,Indore  India,Indore  India,Mumbai
96270263,Rajiv Pande,RAJEEVPANDE2405,syedaamir     HiHyderabad Repoll in how many wards or booths in Hyderabad  And why  Was there some rigging or some other issues,Nagpur,Nagpur,Hyderabad
166573064,🚌🚲🛴🚶‍♂,citywalkcycle,CityOrdinary Why whole JH and BH run around KBR park in their cars  Now ppl give us gyan that it is to connect IT hub of Hyderabad,Coimbatore  India,Coimbatore  India,Hyderabad
1106176933904015362,MultiplyMyLeads,multiplymyleads,Plot   Land for Sale      Lacs in CBC LORVEN PLATINA in YACHARAM  Yacharam Mandal    Sq  Yards This plot is gove,Delhi,Delhi,Hyderabad
519193958,V6 News,V6News,Arrangements Getting Ready For GHMC Election Counting   V  News  GHMCElection      Hyderabad  GHMC  V News,Hyderabad  Telangana  India,Hyderabad  Telangana  India,Hyderabad
2836016810,Srinivas Koneti,koneti_srinivas,MDHMWSSB DRINKING WATER LEAKAGE not only causing POLLUTION but also wasting valuable water at            SAIRAM co,Hyderabad,Hyderabad,Hyderabad
781391908962701312,karan boricha,karanboricha18,mybmc I just saw two people come and paint this tree  How irresponsible and unprofessional is this on your part  T,Mumbai  India,Mumbai  India,Mumbai
1885602206,WeatherChennai,WeatherChennai,Right now  Drizzle  Temperature    C  Humidity      Wind  From ENE at    KPH  Updated       AM  Chennai  Weather,Chennai  India,Chennai  India,Chennai
1876840346,Devang Dave,DevangVDave,Maharashtra  Bharatiya Janata Party wins the Dhule and Nandurbar local body by elections against the entire,Mumbai  Maharashtra,Mumbai  Maharashtra,Mumbai
1284508776368930816,𝔸𝕛𝕒𝕪 𝕐𝕒𝕕𝕒𝕧 𝟠𝟟𝟠𝟚,shanta_yadav_1,Satyabr          GooglePayIndia Do anyone have hyderabad ticket,Delhi  India,Delhi  India,Hyderabad
810943829536686080,AIR News Hyderabad,airnews_hyd,Listen to today s Covid    Spl Bulletin in Telugu at    am from All India Radio News  Hyderabad https   t co dVUnvNebyz,Hyderabad  India,Hyderabad  India,Hyderabad
982411422905778176,IndSamachar News,Indsamachar,I never go back on the promises I make  Political change is necessary  It is the need of the hour  If it is not don,India,India,Chennai
37034483,NDTV,ndtv,Tamil Nadu and Kerala brace for  CycloneBurevi  Heavy to very heavy rainfall expected in the southern parts of the,India,India,Chennai
818490257171582976,Saikat Majumder,SaikatRanchi,TelanganaCMO  KTRTRS  RaoKavitha  trspartyonline Please extend all possible help including financial help and save,Ranchi  Jharkhand   India,Ranchi  Jharkhand   India,Hyderabad
843092490,Ved Prakash,vprakash568,The epidemic devastated the global economy and Mumbai   where the family lives in a    story skyscraper called Anti,India,India,Mumbai
546550655,Epistemo,epistemoschool,Much like Steve Jobs  we believe one should always be open to new lessons  Please visit,Hyderabad  India,Hyderabad  India,Hyderabad
2597891065,Palladium Mumbai,PalladiumMum,Explore  BOSSGenerations designed for the Bold and the Brave  Get your hands on the latest graphic styles at,Mumbai,Mumbai,Mumbai
138347068,The Siasat Daily,TheSiasatDaily,Re polling for  OldMalakpet ward began at   a m  at    centers  It will continue till   p m  For the election,Hyderabad  India,Hyderabad  India,Hyderabad
2422520389,Sanjay,Sanjay300683,Deepali p  BJP India You mean artist only borns in Mumbai,Stockholm  Sweden,Stockholm  Sweden,Mumbai
22052895,TMJ-INH IT Jobs,tmj_inh_it,Don t submit then quit  Apply for jobs like  Cyber Risk   Consultant Sr  Consultant   BPRC  at Deloitte  then look,Hyderabad,Hyderabad,Hyderabad
88164343,PropertyWala.com,propertiesindia,Spacion Business Centre  OfficeSpace  ForRent  HitechCity  Hyderabad  Commercial  Property https   t co mJlAKTqMev,India,Rajendra Nagar,Hyderabad
1261604248636190720,KTC Weatherman,saran_2016,AdarshPCherugad Welcome to Chennai during NEM,Chennai  India,Chennai  India,Chennai
4429974280,Dr Andrew Fleming,Andrew007Uk,Happy birthday  PrathyushaCFA     though you will miss your friends and family from Hyderabad today your learning i,Hyderabad  Telangana State,Hyderabad,Hyderabad
54241790,sridevi sreedhar,sridevisreedhar,SarpattaParambarai   The clash between two clans in North Chennai  arya offl  beemji READ IN PICS,Chennai  India,Chennai  India,Chennai
796069644,Puja Pandey,PujaKj143,Just posted a photo   Mumbai  Maharashtra,Bandra West  Mumbai,Mumbai,Mumbai
1243815422174138368,Manu Kumar Mishra,ManuKum80871371,brigvkagrawal  JaideepMathur   ANI Sir if we see history   After partition film city was shifted from Lahore to cu,Dubai  United Arab Emirates,Dubai  United Arab Emirates,Mumbai
36117076,parvez ahmed,parvez1,atShruti leveraging the power of  ama I am asking you to please do more for  Mumbai   Bengaluru   India and the,Bangalore,Bengaluru South,Mumbai
1291735290617294850,TheShortLong,TheShortLong2,Haldia   gt  Mumbai   gt  Amsterdam   gt  Cologne   gt  Kuwait   gt  Malaysia   gt  Saudi Arabia   gt  Japan   gt  Pune Next work location,Mumbai  India,Mumbai  India,Mumbai
33460813,N Shekar 🇮🇳,n_shekar,ChPaiyan Welcome to Chennai,Tamilnadu India,Tamilnadu India,Chennai
3638215945,Mirror Now,MirrorNow,In the faceoff between  SerumInstituteofIndia and the  Covishield volunteer from  Chennai  DCGI in its probe has fo,India,India,Chennai
1092087752009633792,@LAMOTIVIDS,lamotivids,percentage Hyderabad people straight away rejected these political leaders  Shame on you all political leader,Hyderabad  India,Hyderabad  India,Hyderabad
826068171610324993,BBG INDIA - Building Blocks Group,bbgindia,Your Family Is Your True Wealth       bbg  bbgindia  bbgfoundation  buildingblocksgroup  truewealth  family,Hyderabad  India,Hyderabad  India,Hyderabad
30859231,TOI Mumbai,TOIMumbai,Rs       crore Maharashtra govt dole for cash strapped transport body,Mumbai,Mumbai,Mumbai
991973986727849984,Telangana State Innovation Cell (TSIC),teamTSIC,Hey  Hyderabad     hours to go   Join us today on International Day for Disabled Persons to  celebrate  innovations,Hyderabad  India,Hyderabad  India,Hyderabad
838087438711021568,Nandhu Tarak Thalapathy,nandhunandamuri,Tenet bookings in hyderabad,Hyderabad  India,Hyderabad  India,Hyderabad
88164343,PropertyWala.com,propertiesindia,Seaters  OfficeSpace  ForRent  Nungambakkam  Chennai  Commercial  Property https   t co xoibduLa,India,Egmore Nungambakkam,Chennai
742633777067790337,Fight_for_good_health,plutotrainings1,Many will meet accident and loose lives in city like mumbai and pune    People have habit of jumping off running tr,Mumbai  India,Mumbai  India,Mumbai
1303777256,Naresh i Technologies,nareshitech,Enroll Now  Attend Free Demo on CRT Online Training By Mr  Hari Krishna Starts From   th De,Hyderabad  Chennai  India,Hyderabad  Chennai  India,Hyderabad
577100884,Live Chennai,Live_Chennai,On   th December   Koyambeduflowermarket to  reopen https   t co ImicCGkNAP,Chennai  India,Chennai  India,Chennai
34245009,India TV,indiatvnews,Mumbai    women thrash BMC employee when asked to wear  mask  in Bhandup   via  IndiaTVNews,India,India,Mumbai
1724195040,Vinod,onemevinod,Dear  Chennai take care  CycloneBurevi,South of India,Vellore,Chennai
757440598609539073,Sanandhu Sankar,AlluSanandhu,Mask smile      AlluArjun back to Hyderabad  Pushpa  pushparaj,Pathanamthitta  India,Pathanamthitta  India,Hyderabad
134758540,The Times Of India,timesofindia,Women can t climb poles  says power companies  Telangana HC orders test https   t co ym aLVm NK via  TOIHyderabad,New Delhi,New Delhi,Hyderabad
1315702266716880898,Alkhaleej Tours,AlkhaleejTours,Travel with us to Mumbai  India  Get to see the most expensive house in the world  The Antilia   Book now on,London  UK,London  UK,Mumbai
88164343,PropertyWala.com,propertiesindia,Apartment in Yashodham Complex   Mumbai   BHK  Flat  ForRent  GoregaonEast  Residential  Property https   t co kI  iXYoYU,India,Mumbai,Mumbai
78941611,Harsha Bhogle,bhogleharsha,Congratulations to the Alliance Francaise of Hyderabad  AFHyderabad on completing    years there and helping the sp,Mumbai  India,Mumbai  India,Hyderabad
94156296,CN,chemc1990,ZeeMohamed      of all Hindi movies are shot in Up  amp  Bihar  Make sense to have a film industry than at Mumbai,New Delhi  India,New Delhi  India,Mumbai
89060653,Prabhu Mallikarjunan,PrabhuM_journo,BJP goes the whole hog in Hyderabad and with a reason   The Federal,Bengaluru  India,Bengaluru  India,Hyderabad
831167088,Sunny Shines 🇮🇳,SunnyShines_,beingsaniya   Hyderabad and biryani and ofcourse me,Jupiter,Jupiter,Hyderabad
162327125,ganapathy hegde,ganapathyhegde,Jaz baatein I have not seen any Bollywood in Mumbai  All films are shot in Ramoji film city or Chennai or abroad,mangalore,mangalore,Chennai
83389371,Arun Dan Yellamaty,arunyellamaty,Shared this tweet   days ago  no one responded  I guess you need to have a better support staff   better quality hy,Hyderabad  India,Hyderabad  India,Hyderabad
742211562,Sakshi Post,SakshiPost,GHMC Elections       Re Polling Begins At Old Malakpet  Hyderabad  GHMCElections      OldMalakpet https   t co  bjSTYzqPn,Hyderabad  India,Hyderabad  India,Hyderabad
1269142565887963136,Adityabhadana,Adityab67440241,Mumbai Is Not Safe For Actors Mumbai Is Not Safe For Media Mumbai Is Not Safe For Sadhu Sants I Demand Shift Bo,New Delhi  India,New Delhi  India,Mumbai
1300089995609272321,Manmohan,Authormngmnt,LiveLawIndia  barandbench  rsprasad Where is justice     ED on Fake TRP did not find Republic TV involved     H,Bangalore,Bangalore,Mumbai
207077798,Expleo Group,ExpleoGroup,Our constant endeavor to uplift the society continues  This time  Balaji Viswanathan MD  amp  CEO of Expleo Solutions a,Global,Global,Chennai
1256253146130759680,Balamurugan R,Balamurugan_R1,BloodDonorsIn Can you please help on this PATIENT NAME  Krishnamurthy A Age     Cause of Effect   Kidney injury B,Thanjavur  India,Thanjavur  India,Chennai
22760847,Friends2Support.org,friends2support,Need  A  blood donors to the patient Krishnamurthy A in  SIMS Vadapalani  Chennai on             Kindly contact             Friends Support,India,India,Chennai
28517909,Sharell Cook,AboutIndia,himopines  AtanuDeb   Totally  And I sweat like crazy in the Mumbai heat and humidity  so am always pulling it dow,Mumbai  India,Mumbai  India,Mumbai
88164343,PropertyWala.com,propertiesindia,Aliens Space Station   BHK  Apartment  Flat  ForSale  Gachibowli  Hyderabad  Residential  Property https   t co r sC Peqva,India,Rajendra Nagar,Hyderabad
2446862880,Regen Verhinderer - the rain-stopper from Chennai,RegenVerhindere,praddy   Will continue upto    Dec  See my earlier tweets  Last night a      pm I woke up to fight the rains  So i,Chennai   India,Chennai   India,Chennai
4284897826,videshconsultz,videshconsultz,Develop A Global Perpesctive with Overseas Education by Videsh Consultz Get Free Online Counseling by Videsh Cons,Hyderabad  India,Hyderabad  India,Hyderabad
956486220686639104,Open Space Foundation,Official_OSF,GenderTalks We welcome you all to the upcoming Gender Talks Topic     Gender  amp  Poverty will be delivered by Ranjan,Chennai  India,Chennai  India,Chennai
2196124452,wahab khan,wahabkhan1996,KanganaTeam   JANUARY MUMBAI COURT DONT FORGET,Bettiah  India,Bettiah  India,Mumbai
165111235,AHMED HUSSAIN MANSOORI,ahmansoori,CPHydCity Sir It s really nice to have You as a GREAT LEADER FOR HYDERABAD Appreciate Your Job  ThankYou,Hyderabad  India,Hyderabad  India,Hyderabad
1156273506486611968,Mr.Raja ;-),Marana_Mass,Join me in visiting all cities in the Go India game  amp  earn a reward up to,India,India,Chennai
14935529,Citizen Matters,citizenmatters,Calling for volunteers to help fix Chennai voter rolls https   t co wPiwxQROQ,India,India,Chennai
15459391,SpeedBird,SpeedBird_NCL,How Mumbai airport is preparing to transport the Covid    vaccine  https   t co S jymI PVO  Aviation  Airport,Worldwide,Worldwide,Mumbai
241993358,Dev acharya,dev7114,ANI What a cheap politician  These ppl will representation f citizens  I doubt  How some  in govt refer a state as,Bengaluru  India,Bengaluru  India,Mumbai
1275336704115654659,Karthik,KarthikCongress,tejjINC Preparations should be started ASAP  First  full time Mumbai president should be appointed,Tamilnadu,Tamilnadu,Mumbai
1059858186092535808,Sanathan sanskrathi,ChandrakanthaA3,ShefVaidya    SnehaNa            republic    Shehzad Ind Very funny still it s fact till few decades back tamilai,India,India,Chennai
38069711,TMJ-INH Jobs,tmj_inh_jobs,Deloitte is looking for teammates like you  See our latest  BusinessMgmt job openings  including  CIS Neoxam  u,Hyderabad,Hyderabad,Hyderabad
1248292301987667969,Srinivasan G,srinicaps,sundarmail Someone from Chennai sold full HDFC bank in portfolio alongside with Ex   CEO    can it be named inside,Mumbai  India,Mumbai  India,Chennai
818490257171582976,Saikat Majumder,SaikatRanchi,msdhoni  SaakshiSRawat  msdfansofficial My brother born  amp  brought up in Ranchi and presently residing in Hyderabad,Ranchi  Jharkhand   India,Ranchi  Jharkhand   India,Hyderabad
822055645318778880,Vicky Gupta,vstarsun,PiyushGoyalOffc sir  Kalyan junction railway station in mumbai charging     rupees for platform ticket  They are at platform number,Bangalore,Bangalore,Mumbai
3929140655,SAM KHAN,SamKhanpti1,Thank you Wwing Hyderabad for your respect and love,Karachi  Pakistan,Karachi  Pakistan,Hyderabad
72552866,Top U.S. & World News🗽,USRealityCheck,India Resumes Talks With Protesting Farmers Over Agriculture Laws By Mayank Bhardwaj and Rajendra JadhavNEW DELHI M,USA,USA,Mumbai
